{
  "record_type": "sphera.state-nft",
  "schema_version": "1.0.0",
  "nft_id": {"chain_id": "eip155:1", "contract": "0x2222222222222222222222222222222222222222", "token_id": "9001"},
  "engine_ref": {"chain_id": "eip155:1", "contract": "0x1111111111111111111111111111111111111111", "token_id": "42"},
  "revision": 1,
  "previous_revision": null,
  "snapshot": {
    "uri": "ipfs://bafybeigdystaterev1example",
    "sha256": "cccccccccccccccccccccccccccccccccccccccccccccccccccccccccccccccc"
  },
  "provenance": {
    "created_at": "2026-08-08T00:01:00Z",
    "created_by": "did:key:z6MkPlayerExample",
    "source_uri": "ipfs://bafybeigdyeventlogrev1example",
    "source_sha256": "dddddddddddddddddddddddddddddddddddddddddddddddddddddddddddddddd"
  }
}
