{
  "record_type": "sphera.state-nft",
  "schema_version": "1.0.0",
  "nft_id": {"chain_id": "eip155:1", "contract": "0x2222222222222222222222222222222222222222", "token_id": "9001"},
  "engine_ref": {"chain_id": "eip155:1", "contract": "0x1111111111111111111111111111111111111111", "token_id": "42"},
  "revision": 2,
  "previous_revision": {
    "revision": 1,
    "record_sha256": "c7a558e5f2a7228ec20be42a9a6279e66d42c8d3d6d25c8bc0402acaef586a5d"
  },
  "snapshot": {
    "uri": "ipfs://bafybeigdystaterev2example",
    "sha256": "ffffffffffffffffffffffffffffffffffffffffffffffffffffffffffffffff"
  },
  "provenance": {
    "created_at": "2026-08-08T00:02:00Z",
    "created_by": "did:key:z6MkPlayerExample",
    "source_uri": "ipfs://bafybeigdyeventlogrev2example",
    "source_sha256": "0123456789abcdef0123456789abcdef0123456789abcdef0123456789abcdef"
  }
}
